{
    "$schema": "http://json-schema.org/draft-07/schema#",
    "$id": "http://example.com/example.json",
    "type": "object",
    "title": "The Root Schema",
    "description": "The root schema comprises the entire JSON document.",    
    "required": [
        "name",
        "displayName",
        "description",
        "metadata",
        "policyDefinitions",
        "parameters"
    ],
    "properties": {
        "name": {
            "$id": "#/properties/name",
            "type": "string",
            "minLength": 1,
            "maxLength": 128,
            "title": "The Initiative-name Schema",
            "description": "Name of the Initiative",
            "default": "",
            "examples": [
                "BillingTagInitiative"
            ]
        },
        "displayName": {
            "$id": "#/properties/displayName",
            "type": "string",
            "minLength": 1,
            "maxLength": 128,
            "title": "The Initiative-displayname Schema",
            "description": "Displayname of the Initiative",
            "default": "",
            "examples": [
                "Billing Tags Policy Initiative"
            ]
        },
        "description": {
            "$id": "#/properties/description",
            "type": "string",
            "minLength": 1,
            "maxLength": 512,
            "title": "The Initiative description Schema",
            "description": "Description of the Initiative.",
            "default": "",
            "examples": [
                "Specify tags used for billing (e.g. CostCenter and OwnerEmail)"
            ]
        },
        "metadata": {
            "$id": "#/properties/metadata",
            "type": "object",
            "title": "The Metadata Schema",
            "description": "Metadata for the Initiative.",
            "default": {},
            "additionalProperties": true,
            "required": [
                "category"
            ],
            "properties": {
                "category": {
                    "$id": "#/properties/metadata/properties/category",
                    "type": "string",
                    "title": "The Category Schema",
                    "description": "The category of the Initiative",
                    "default": ""
                }
            }
        },
        "policyDefinitions": {
            "$id": "#/properties/policyDefinitions",
            "type": "array",
            "minItems": 1,
            "maxItems": 100,
            "uniqueItems": true,
            "title": "The policyDefinitions Schema",
            "description": "Here all the referenced policyDefinitions, that are grouped within this initiative are defined.",
            "additionalItems": true,
            "items": {
                "$id": "#/properties/policyDefinitions/items",
                "type": "object",
                "title": "The Items Schema",
                "description": "Id and parameters for the referenced policyDefinitions",
                "additionalProperties": false,
                "required": [
                    "policyDefinitionId",
                    "parameters"
                ],
                "properties": {
                    "policyDefinitionId": {
                        "$id": "#/properties/policyDefinitions/items/properties/policyDefinitionId",
                        "type": "string",
                        "title": "The policyDefinitionID Schema",
                        "description": "A policyDefinitionID that shall be part of the Initiative",
                        "default": "",
                        "oneOf": [
                            { "pattern": "^/providers/Microsoft.Authorization/policyDefinitions/([a-f]|[0-9]){8}-([a-f]|[0-9]){4}-([a-f]|[0-9]){4}-([a-f]|[0-9]){4}-([a-f]|[0-9]){12}$" },
                            { "pattern": "^/subscriptions/([a-f]|[0-9]){8}-([a-f]|[0-9]){4}-([a-f]|[0-9]){4}-([a-f]|[0-9]){4}-([a-f]|[0-9]){12}/providers/Microsoft.Authorization/policyDefinitions/.+[^/]$" },
                            { "pattern": "^/providers/Microsoft.Management/managementGroups/[^/]+/providers/Microsoft.Authorization/policyDefinitions/.+[^/]$" }
                        ],
                        "examples": [
                            "/providers/Microsoft.Authorization/policyDefinitions/cd3aa116-8754-49c9-a813-ad46512ece54"
                        ]

                    },
                    "parameters": {
                        "$id": "#/properties/policyDefinitions/items/properties/parameters",
                        "type": "object",
                        "minProperties": 0,
                        "maxProperties": 20,
                        "title": "The Parameters Schema",
                        "description": "All parameters required by the policy definitionID",
                        "default": {}
                    },
                    "policyDefinitionReferenceId": {
                        "$id": "#/properties/policyDefinitions/items/properties/policyDefinitionReferenceId",
                        "type": "string",
                        "title": "The policyDefinitionReferenceId Schema",
                        "description": "A policyDefinitionReferenceId is an optional part of the Initiative",
                        "default": ""                        
                    },
                    "groupNames": {
                        "$id": "#/properties/policyDefinitions/items/properties/groupNames",
                        "type": "array",
                        "title": "The groupName Schema",
                        "description": "A groupName is an optional part of the Initiative",
                        "default": []
                    }
                }
            }
        },
        "parameters": {
            "$id": "#/properties/properties/properties/parameters",
            "type": "object",
            "minProperties": 0,
            "maxProperties": 100,
            "title": "The Parameters Schema",
            "description": "Parameters for the Initiative definition that can be used within the various policyDefinition parameters",
            "default": {}
        },
        "policyDefinitionGroups": {
            "$id": "#/properties/policyDefinitionGroups",
            "type": "array",
            "title": "The policyDefinitionGroups Schema",
            "description": "Definition of policyDefinitionGroups that can be used to group the various policyDefinitions",
            "default": {}
        }
    }
}